{
  "order_number": "DO-198-18",
  "title": "Implementing Rules and Regulations of Republic Act No. 11058 (An Act Strengthening Compliance with Occupational Safety and Health Standards and Providing Penalties for Violations Thereof)",
  "effective_date": "2018-12-06",
  "source_url": "https://www.dole.gov.ph/php_assets/uploads/2019/01/DO-198-Implementing-Rules-and-Regulations-of-Republic-Act-No_-11058-An-Act-Strengthening-Compliance-with-Occupational-Safety-and-Health-Standards-and-Providing-Penalties-for-Violations-Thereof.pdf",
  "metadata": {
    "issuing_authority": "Secretary of Labor and Employment",
    "supersedes": [],
    "related_laws": [
      "RA 11058",
      "RA 9165",
      "RA 11036",
      "RA 8504",
      "PD 442 (Labor Code)"
    ],
    "tags": [
      "contracting",
      "OSH",
      "wages",
      "termination"
    ]
  },
  "sections": [
    {
      "section_number": "Section 1",
      "title": "Declaration of Policy",
      "content": "The State affirms labor as a primary social and\neconomic force, and that a safe and healthy workforce is an integral aspect of nation building.\n\nThe State shall ensure a safe and healthful workplace for all working people by\naffording them full protection against all hazards in their work environment. It shall ensure\n\nthat the provisions of the Labor Code of the Philippines, all domestic laws, and\ninternationally-recognized standards on occupational safety and health are being fully\nenforced and complied with by the employers, and it shall provide penalties for any violation\n\nthereof.\n\nThe State shall protect every worker against injury, sickness or death through safe and\n\nhealthful working conditions thereby assuring the conservation of valuable manpower\n\nresources and the prevention of loss or damage to lives and properties consistent with\nnational development goals, and with the State’s commitment to the total development of\nevery worker as a complete human being.\n\nThe State, in protecting the safety and health of the workers, shall promote strict but\ndynamic, inclusive, and gender-sensitive measures in the formulation and implementation of\npolicies and programs related to occupational safety and health.\n\nCHAPTER II\nGENERAL PROVISIONS"
    },
    {
      "section_number": "Section 2",
      "title": "Coverage",
      "content": "This Rules shall apply to all establishments, projects and sites,\nand all other places where work is being undertaken in all branches of economic activity,\nincluding:\n Page 1 of 23",
      "subsections": [
        {
          "label": "a",
          "content": "Establishments located inside special economic zones and other investment\npromotion agencies (e.g., Philippine Economic Zone Authority [PEZA], Clark\nDevelopment Corporation [CDC]);"
        },
        {
          "label": "b",
          "content": "Utilities engaged in air, sea, and land transportation; and"
        },
        {
          "label": "c",
          "content": "Industries such as mining, fishing, construction, agriculture, and maritime.\n\nThis Rules shall also cover contractors and subcontractors including those engaged in\nthe projects of the public sector. Workers of contractors and subcontractors should follow the\nOSH policy and program of the establishment where they are assigned.\n\nThis Rules does not apply to the public sector such as national government agencies,\ngovernment-owned and controlled corporations with original charters, government financial\ninstitutions, state universities and colleges and local government units which shall be\ngoverned by appropriate rules and regulations issued by the Civil Service Commission and\nother government agencies."
        }
      ]
    },
    {
      "section_number": "Section 3",
      "title": "Definition of Terms",
      "content": "As used in this Rules, the following terms shall\nmean:",
      "subsections": [
        {
          "label": "a",
          "content": "Certified first-aider refers to any person trained and duly certified to administer\nfirst aid by the Philippine Red Cross or any organization authorized by the Secretary of Labor\n\nand Employment."
        },
        {
          "label": "b",
          "content": "Competency Standards refer to industry-determined specifications of proficiency\nrequired for effective work performance. These are expressed as outcomes with focus on\nworkplace activity rather than training or personal attributes, and the ability to apply new\nskills in new situations or changing work organization."
        },
        {
          "label": "c",
          "content": "Covered workplaces refer to establishments, projects, sites and all other places\nwhere work is being undertaken wherein the number of employees, nature of operations, and\nrisks or hazards involved in the business, as determined by the Secretary of Labor and\nEmployment, require compliance with the provisions of this Rules."
        },
        {
          "label": "d",
          "content": "Department of Labor and Employment (DOLE)-Accredited Training\nOrganizations refer to those which have been granted accreditation by DOLE pursuant to\nDepartment Order No. 16, Series of 2001 and its subsequent regulations."
        },
        {
          "label": "ec",
          "content": "Employer refers to any person, natural or juridical, including the principal\nemployer, contractor or subcontractor, if any, who directly or indirectly benefits from the\nservices of the employee."
        },
        {
          "label": "f",
          "content": "Equipment refers to any machine with engine or electric motor as prime mover."
        },
        {
          "label": "g",
          "content": "General safety and health inspection refers to an examination of the work\nenvironment, including the location and operation of machinery other than those covered by\ntechnical safety audits, adequacy of work space, ventilation, lighting, conditions of work\nenvironment, handling, storage or work procedures, protection facilities and other possible\nsources of safety and health hazards in the workplace."
        },
        {
          "label": "h",
          "content": "High risk establishment refers to a workplace wherein the presence of hazard or\npotential hazard within the company may affect the safety and/or health of workers not only\nwithin but also persons outside the premises of the workplace. There is high level of\nexposure to safety and health hazards, and probability of a major accident resulting to\n\nPage 2 of 23\n\ndisability or death or major illness is likely to occur if no preventive or contro! measures are\nin place. The following are workplaces commonly associated with potentially high-risk\nactivities:\n . Chemical works and chemical production plants;\n\n. Construction;\n\n. Deep sea fishing;\n\n. Explosives and pyrotechnics factories;\n\n. Firefighting;\n\n. Healthcare facilities;\n\n. Installation of communication accessories, towers and cables;\n\n. LPG filling, refilling, storage and distribution;\n\n. Mining;\n\n. Petrochemical and biofuel works and refineries;\n\n. Power generation, transmission and distribution in the energy sector;\n\n. Storage, handling, and distribution center for toxic or hazardous chemicals;\n\n. Storage and handling of fertilizers in high volume;\n\n. Transportation;\n\n. Water supply, sewerage, waste management, remediation activities;\n\n. Works in which chlorine is used in bulk; and\n\n. Activities closely similar to those enumerated above and other activities as\ndetermined by DOLE in accordance with existing issuances on the\nclassification of establishments.Worn A OS WN —met pee et ee“An BP WD = &"
        },
        {
          "label": "i",
          "content": "Imminent danger refers to a situation caused by a condition or practice in any\nplace of employment that could reasonably be expected to lead to death or serious physical\n\nharm."
        },
        {
          "label": "j",
          "content": "Low risk establishment refers to a workplace where there is low level of danger or\n\nexposure to safety and health hazards and not likely or with low probability to result in\n\naccident, harm or injury, or illness."
        },
        {
          "label": "k",
          "content": "Medium risk establishment refers to a workplace where there is moderate\n\nexposure to safety and health hazards and with probability of an accident, injury or illness, if\n\nno preventive or control measures are in place."
        },
        {
          "label": "1",
          "content": "Micro and Small Enterprises (MSEs) refers to establishments employing less than\n\nten (10) employees, and the establishments employing less than one hundred (100)\n\nemployees, respectively, regardless of capitalization."
        },
        {
          "label": "m",
          "content": "Occupational Health (OH) personnel refer to a qualified first-aider, nurse, dentist\nor physician engaged by the employer to provide occupational health services in the\nestablishment, project, site or workplace."
        },
        {
          "label": "n",
          "content": "Occupational Safety and Health (OSH) consultant refers to a qualified Safety\nOfficer 4 or its equivalent, duly certified by DOLE to perform and/or render consultative\nservices on occupational safety and health in at least two (2) fields of specialization as\ndetermined by DOLE."
        },
        {
          "label": "0",
          "content": "Occupational Safety and Health (OSH) practitioner refers to a qualified Safety\nOfficer 3 or its equivalent, duly certified by DOLE to render occupational safety and health\nservices in a defined and specific scope or core competency.\n Page 3 of 23"
        },
        {
          "label": "p",